
SQL*Plus: Release 11.2.0.2.0 Production on Thu Jan 8 16:39:27 2026

Copyright (c) 1982, 2014, Oracle.  All rights reserved.

SQL> connect / as sysdba;
Connected.
SQL> create user idba identified by idba;

User created.

SQL> connect idba;
Enter password:
ERROR:
ORA-01045: user IDBA lacks CREATE SESSION privilege; logon denied


Warning: You are no longer connected to ORACLE.
SQL> connect / as sysdba;
Connected.
SQL> grant all privileges to idba;

Grant succeeded.

SQL> connect idba;
Enter password:
Connected.
SQL> connect / as sysdba;
Connected.
SQL> revoke all privileges from idba;

Revoke succeeded.

SQL> connect idba;
Enter password:
ERROR:
ORA-01045: user IDBA lacks CREATE SESSION privilege; logon denied


Warning: You are no longer connected to ORACLE.
SQL> drop user idba;
SP2-0640: Not connected
SQL> connect / as sysdba;
Connected.
SQL> drop user idba;

User dropped.

SQL> connect idba;
Enter password:
ERROR:
ORA-01017: invalid username/password; logon denied


Warning: You are no longer connected to ORACLE.
SQL> connect / as sysdba;
Connected.
SQL> create user idba identified by idba;

User created.

SQL> grant all privileges to idba;

Grant succeeded.

SQL> connect idba;
Enter password:
Connected.
SQL> connect idba;
Enter password:
ERROR:
ORA-01017: invalid username/password; logon denied


Warning: You are no longer connected to ORACLE.
SQL> connect idba;
Enter password:
Connected.
SQL> create table Student (htno number(5),sname char(20),percentage number(5,2));

Table created.

SQL> desc student;
 Name                                      Null?    Type
 ----------------------------------------- -------- ----------------------------
 HTNO                                               NUMBER(5)
 SNAME                                              CHAR(20)
 PERCENTAGE                                         NUMBER(5,2)

SQL> insert into student values (101,'Krishna',99.99);

1 row created.

SQL> select * from student;

      HTNO SNAME                PERCENTAGE
---------- -------------------- ----------
       101 Krishna                   99.99

SQL> insert into student values ('abcd','Krishna',99.99);
insert into student values ('abcd','Krishna',99.99)
                            *
ERROR at line 1:
ORA-01722: invalid number


SQL> insert into student values (101,'1234',99.99);

1 row created.

SQL> insert into student values (101,1234,99.99);

1 row created.

SQL> select * from student;

      HTNO SNAME                PERCENTAGE
---------- -------------------- ----------
       101 Krishna                   99.99
       101 1234                      99.99
       101 1234                      99.99

SQL> insert into student values (101,Krishna,99.99);
insert into student values (101,Krishna,99.99)
                                *
ERROR at line 1:
ORA-00984: column not allowed here


SQL> insert into student values (101,$^$^$%,99.99);
insert into student values (101,$^$^$%,99.99)
                                *
ERROR at line 1:
ORA-00911: invalid character


SQL> insert into student values (101,'$^$^$%',99.99);

1 row created.

SQL> select * from student;

      HTNO SNAME                PERCENTAGE
---------- -------------------- ----------
       101 Krishna                   99.99
       101 1234                      99.99
       101 1234                      99.99
       101 $^$^$%                    99.99

SQL> select * from student;

      HTNO SNAME                PERCENTAGE
---------- -------------------- ----------
       101 Krishna                   99.99
       101 1234                      99.99
       101 1234                      99.99
       101 $^$^$%                    99.99

SQL> commit;

Commit complete.

SQL> update student htno=102;
update student htno=102
                   *
ERROR at line 1:
ORA-00971: missing SET keyword


SQL> update student set htno=102;

4 rows updated.

SQL> select * from student;

      HTNO SNAME                PERCENTAGE
---------- -------------------- ----------
       102 Krishna                   99.99
       102 1234                      99.99
       102 1234                      99.99
       102 $^$^$%                    99.99

SQL> rollback;

Rollback complete.

SQL> select * from student;

      HTNO SNAME                PERCENTAGE
---------- -------------------- ----------
       101 Krishna                   99.99
       101 1234                      99.99
       101 1234                      99.99
       101 $^$^$%                    99.99

SQL> update student set htno=102 where sname='$^$^$%';

1 row updated.

SQL> select * from student;

      HTNO SNAME                PERCENTAGE
---------- -------------------- ----------
       101 Krishna                   99.99
       101 1234                      99.99
       101 1234                      99.99
       102 $^$^$%                    99.99

SQL> update student set sname='Sravan' where sname='$^$^$%';

1 row updated.

SQL> select * from student;

      HTNO SNAME                PERCENTAGE
---------- -------------------- ----------
       101 Krishna                   99.99
       101 1234                      99.99
       101 1234                      99.99
       102 Sravan                    99.99

SQL> commit;

Commit complete.

SQL> delete student;

4 rows deleted.

SQL> select * from student;

no rows selected

SQL> rollback;

Rollback complete.

SQL> select * from student;

      HTNO SNAME                PERCENTAGE
---------- -------------------- ----------
       101 Krishna                   99.99
       101 1234                      99.99
       101 1234                      99.99
       102 Sravan                    99.99

SQL> delete student where sname='1234';

2 rows deleted.

SQL> select * from student;

      HTNO SNAME                PERCENTAGE
---------- -------------------- ----------
       101 Krishna                   99.99
       102 Sravan                    99.99

SQL>
--------------------------------------
09-01-2026


SQL*Plus: Release 11.2.0.2.0 Production on Fri Jan 9 16:09:01 2026

Copyright (c) 1982, 2014, Oracle.  All rights reserved.

SQL> connect idba;
Enter password:
Connected.
SQL> create table emp(eid number(1),ename number(20));

Table created.

SQL> desc emp;
 Name                                      Null?    Type
 ----------------------------------------- -------- ----------------------------
 EID                                                NUMBER(1)
 ENAME                                              NUMBER(20)

SQL> alter table emp add(jod date);

Table altered.

SQL> desc emp;
 Name                                      Null?    Type
 ----------------------------------------- -------- ----------------------------
 EID                                                NUMBER(1)
 ENAME                                              NUMBER(20)
 JOD                                                DATE

SQL> alter table emp modify (eid number(5),ename varchar2(20));

Table altered.

SQL> desc emp;
 Name                                      Null?    Type
 ----------------------------------------- -------- ----------------------------
 EID                                                NUMBER(5)
 ENAME                                              VARCHAR2(20)
 JOD                                                DATE

SQL> alter table emp rename column jod to doj;

Table altered.

SQL> desc emp;
 Name                                      Null?    Type
 ----------------------------------------- -------- ----------------------------
 EID                                                NUMBER(5)
 ENAME                                              VARCHAR2(20)
 DOJ                                                DATE

SQL> alter table emp modify (jod date);
alter table emp modify (jod date)
                        *
ERROR at line 1:
ORA-00904: "JOD": invalid identifier


SQL> alter table emp modify (doj date);

Table altered.

SQL> alter table emp modify (dob date);
alter table emp modify (dob date)
                        *
ERROR at line 1:
ORA-00904: "DOB": invalid identifier


SQL> alter table emp drop column doj;

Table altered.

SQL> desc emp;
 Name                                      Null?    Type
 ----------------------------------------- -------- ----------------------------
 EID                                                NUMBER(5)
 ENAME                                              VARCHAR2(20)

SQL> alter table emp add(doj date);

Table altered.

SQL> desc emp;
 Name                                      Null?    Type
 ----------------------------------------- -------- ----------------------------
 EID                                                NUMBER(5)
 ENAME                                              VARCHAR2(20)
 DOJ                                                DATE

SQL> rename emp to emp1;

Table renamed.

SQL> desc emp;
ERROR:
ORA-04043: object emp does not exist


SQL> desc emp1;
 Name                                      Null?    Type
 ----------------------------------------- -------- ----------------------------
 EID                                                NUMBER(5)
 ENAME                                              VARCHAR2(20)
 DOJ                                                DATE

SQL> select * from tab;

TNAME                          TABTYPE  CLUSTERID
------------------------------ ------- ----------
EMP1                           TABLE
STUDENT                        TABLE

SQL> insert into emp1 values(101,'Krishna','10-jan-26');

1 row created.

SQL> select * from emp1;

       EID ENAME                DOJ
---------- -------------------- ---------
       101 Krishna              10-JAN-26

SQL> insert into emp1 values(102,'Sravan',sysdate);

1 row created.

SQL> select * from emp1;

       EID ENAME                DOJ
---------- -------------------- ---------
       101 Krishna              10-JAN-26
       102 Sravan               09-JAN-26

SQL> sysdate from dual;
SP2-0734: unknown command beginning "sysdate fr..." - rest of line ignored.
SQL> select sysdate from dual;

SYSDATE
---------
09-JAN-26

SQL> select currentdate from dual;
select currentdate from dual
       *
ERROR at line 1:
ORA-00904: "CURRENTDATE": invalid identifier


SQL> select current date from dual;
select current date from dual
       *
ERROR at line 1:
ORA-00936: missing expression


SQL> currentdate from dual;
SP2-0734: unknown command beginning "currentdat..." - rest of line ignored.
SQL> select currentdate from dual;
select currentdate from dual
       *
ERROR at line 1:
ORA-00904: "CURRENTDATE": invalid identifier


SQL> select current date from dual;
select current date from dual
       *
ERROR at line 1:
ORA-00936: missing expression


SQL> select current_date from dual;

CURRENT_D
---------
09-JAN-26

SQL> select timestamp from dual;
select timestamp from dual
       *
ERROR at line 1:
ORA-00904: "TIMESTAMP": invalid identifier


SQL> select time_stamp from dual;
select time_stamp from dual
       *
ERROR at line 1:
ORA-00904: "TIME_STAMP": invalid identifier


SQL> select time stamp from dual;
select time stamp from dual
       *
ERROR at line 1:
ORA-00904: "TIME": invalid identifier


SQL> select timestamp from dual;
select timestamp from dual
       *
ERROR at line 1:
ORA-00904: "TIMESTAMP": invalid identifier


SQL> show timestamp from dual;
SP2-0158: unknown SHOW option "timestamp"
SP2-0158: unknown SHOW option "from"
SP2-0158: unknown SHOW option "dual"
SQL> select systimestamp from dual;

SYSTIMESTAMP
---------------------------------------------------------------------------
09-JAN-26 04.34.15.329000 PM +05:30

SQL> select current_date from dual;

CURRENT_D
---------
09-JAN-26

SQL> select sysdate from dual;

SYSDATE
---------
09-JAN-26

SQL> select * from emp1;

       EID ENAME                DOJ
---------- -------------------- ---------
       101 Krishna              10-JAN-26
       102 Sravan               09-JAN-26

SQL> insert into emp1 values(102,'Sravan');
insert into emp1 values(102,'Sravan')
            *
ERROR at line 1:
ORA-00947: not enough values


SQL> insert into emp1(eid,ename) values(103,'Saraswathi');

1 row created.

SQL> select * from emp1;

       EID ENAME                DOJ
---------- -------------------- ---------
       101 Krishna              10-JAN-26
       102 Sravan               09-JAN-26
       103 Saraswathi

SQL> insert into emp1 values(&eid,&ename,&doj);
Enter value for eid: 104
Enter value for ename: 'Srinivas'
Enter value for doj: sysdate
old   1: insert into emp1 values(&eid,&ename,&doj)
new   1: insert into emp1 values(104,'Srinivas',sysdate)

1 row created.

SQL> /
Enter value for eid: 105
Enter value for ename: 'Bindu'
Enter value for doj: sysdate
old   1: insert into emp1 values(&eid,&ename,&doj)
new   1: insert into emp1 values(105,'Bindu',sysdate)

1 row created.

SQL> select * from emp1;

       EID ENAME                DOJ
---------- -------------------- ---------
       101 Krishna              10-JAN-26
       102 Sravan               09-JAN-26
       103 Saraswathi
       104 Srinivas             09-JAN-26
       105 Bindu                09-JAN-26

SQL> insert into emp1 values(&&eid,&&ename,&&doj);
Enter value for eid: 106
Enter value for ename: 'Supraja'
Enter value for doj: sysdate
old   1: insert into emp1 values(&&eid,&&ename,&&doj)
new   1: insert into emp1 values(106,'Supraja',sysdate)

1 row created.

SQL> //
old   1: insert into emp1 values(&&eid,&&ename,&&doj)
new   1: insert into emp1 values(106,'Supraja',sysdate)

1 row created.

SQL> //
old   1: insert into emp1 values(&&eid,&&ename,&&doj)
new   1: insert into emp1 values(106,'Supraja',sysdate)

1 row created.

SQL> //
old   1: insert into emp1 values(&&eid,&&ename,&&doj)
new   1: insert into emp1 values(106,'Supraja',sysdate)

1 row created.

SQL> select * from emp1;

       EID ENAME                DOJ
---------- -------------------- ---------
       101 Krishna              10-JAN-26
       102 Sravan               09-JAN-26
       103 Saraswathi
       104 Srinivas             09-JAN-26
       105 Bindu                09-JAN-26
       106 Supraja              09-JAN-26
       106 Supraja              09-JAN-26
       106 Supraja              09-JAN-26
       106 Supraja              09-JAN-26

9 rows selected.

SQL> select eid,ename from emp1;

       EID ENAME
---------- --------------------
       101 Krishna
       102 Sravan
       103 Saraswathi
       104 Srinivas
       105 Bindu
       106 Supraja
       106 Supraja
       106 Supraja
       106 Supraja

9 rows selected.

SQL> select eid,ename from emp1 where eid=104;

       EID ENAME
---------- --------------------
       104 Srinivas

SQL> select eid,ename from emp1 where unique
  2  ;
select eid,ename from emp1 where unique
                                 *
ERROR at line 1:
ORA-00936: missing expression


SQL> select eid,ename from emp1 where eid>=103;

       EID ENAME
---------- --------------------
       103 Saraswathi
       104 Srinivas
       105 Bindu
       106 Supraja
       106 Supraja
       106 Supraja
       106 Supraja

7 rows selected.

SQL> select eid,ename from emp1 where eid>=103 and eid<=105;

       EID ENAME
---------- --------------------
       103 Saraswathi
       104 Srinivas
       105 Bindu

SQL> select * from emp1;

       EID ENAME                DOJ
---------- -------------------- ---------
       101 Krishna              10-JAN-26
       102 Sravan               09-JAN-26
       103 Saraswathi
       104 Srinivas             09-JAN-26
       105 Bindu                09-JAN-26
       106 Supraja              09-JAN-26
       106 Supraja              09-JAN-26
       106 Supraja              09-JAN-26
       106 Supraja              09-JAN-26

9 rows selected.

SQL> select eid,ename from emp1 where eid>=103 or eid<=105;

       EID ENAME
---------- --------------------
       101 Krishna
       102 Sravan
       103 Saraswathi
       104 Srinivas
       105 Bindu
       106 Supraja
       106 Supraja
       106 Supraja
       106 Supraja

9 rows selected.

SQL> select eid,ename from emp1 where eid>=103 or eid=105;

       EID ENAME
---------- --------------------
       103 Saraswathi
       104 Srinivas
       105 Bindu
       106 Supraja
       106 Supraja
       106 Supraja
       106 Supraja

7 rows selected.

SQL> select * from emp1 order by ename;

       EID ENAME                DOJ
---------- -------------------- ---------
       105 Bindu                09-JAN-26
       101 Krishna              10-JAN-26
       103 Saraswathi
       102 Sravan               09-JAN-26
       104 Srinivas             09-JAN-26
       106 Supraja              09-JAN-26
       106 Supraja              09-JAN-26
       106 Supraja              09-JAN-26
       106 Supraja              09-JAN-26

9 rows selected.

SQL> select * from emp1 order by ename desc;

       EID ENAME                DOJ
---------- -------------------- ---------
       106 Supraja              09-JAN-26
       106 Supraja              09-JAN-26
       106 Supraja              09-JAN-26
       106 Supraja              09-JAN-26
       104 Srinivas             09-JAN-26
       102 Sravan               09-JAN-26
       103 Saraswathi
       101 Krishna              10-JAN-26
       105 Bindu                09-JAN-26

9 rows selected.

SQL> update emp1 set doj='5-aug-25' where eid=103;

1 row updated.

SQL> select * from emp1 order by ename;

       EID ENAME                DOJ
---------- -------------------- ---------
       105 Bindu                09-JAN-26
       101 Krishna              10-JAN-26
       103 Saraswathi           05-AUG-25
       102 Sravan               09-JAN-26
       104 Srinivas             09-JAN-26
       106 Supraja              09-JAN-26
       106 Supraja              09-JAN-26
       106 Supraja              09-JAN-26
       106 Supraja              09-JAN-26

9 rows selected.

SQL> select * from emp1;

       EID ENAME                DOJ
---------- -------------------- ---------
       101 Krishna              10-JAN-26
       102 Sravan               09-JAN-26
       103 Saraswathi           05-AUG-25
       104 Srinivas             09-JAN-26
       105 Bindu                09-JAN-26
       106 Supraja              09-JAN-26
       106 Supraja              09-JAN-26
       106 Supraja              09-JAN-26
       106 Supraja              09-JAN-26

9 rows selected.

SQL> update emp1 set eid=107 where systimestamp;
update emp1 set eid=107 where systimestamp
                                         *
ERROR at line 1:
ORA-00920: invalid relational operator


SQL> delete emp1 where eid=106;

4 rows deleted.

SQL> select * from emp1;

       EID ENAME                DOJ
---------- -------------------- ---------
       101 Krishna              10-JAN-26
       102 Sravan               09-JAN-26
       103 Saraswathi           05-AUG-25
       104 Srinivas             09-JAN-26
       105 Bindu                09-JAN-26

SQL> create table emp as select * from emp1;

Table created.

SQL> select * from emp1;

       EID ENAME                DOJ
---------- -------------------- ---------
       101 Krishna              10-JAN-26
       102 Sravan               09-JAN-26
       103 Saraswathi           05-AUG-25
       104 Srinivas             09-JAN-26
       105 Bindu                09-JAN-26

SQL> select * from emp;

       EID ENAME                DOJ
---------- -------------------- ---------
       101 Krishna              10-JAN-26
       102 Sravan               09-JAN-26
       103 Saraswathi           05-AUG-25
       104 Srinivas             09-JAN-26
       105 Bindu                09-JAN-26

SQL> create table emp2 as select * from emp1;

Table created.

SQL> select * from tab;

TNAME                          TABTYPE  CLUSTERID
------------------------------ ------- ----------
EMP                            TABLE
EMP1                           TABLE
EMP2                           TABLE
STUDENT                        TABLE

SQL> commit;

Commit complete.

SQL> select * from emp;

       EID ENAME                DOJ
---------- -------------------- ---------
       101 Krishna              10-JAN-26
       102 Sravan               09-JAN-26
       103 Saraswathi           05-AUG-25
       104 Srinivas             09-JAN-26
       105 Bindu                09-JAN-26

SQL> update table set eid=106 where ename='Bindu';
update table set eid=106 where ename='Bindu'
       *
ERROR at line 1:
ORA-00903: invalid table name


SQL> update set eid=105 where ename='Bindu';
update set eid=105 where ename='Bindu'
       *
ERROR at line 1:
ORA-00903: invalid table name


SQL> update table set eid=105 where ename='Bindu';
update table set eid=105 where ename='Bindu'
       *
ERROR at line 1:
ORA-00903: invalid table name


SQL> update emp set eid=105 where ename='Bindu';

1 row updated.

SQL> select * from emp;

       EID ENAME                DOJ
---------- -------------------- ---------
       101 Krishna              10-JAN-26
       102 Sravan               09-JAN-26
       103 Saraswathi           05-AUG-25
       104 Srinivas             09-JAN-26
       105 Bindu                09-JAN-26

SQL> update table set eid=106 where ename='Bindu';
update table set eid=106 where ename='Bindu'
       *
ERROR at line 1:
ORA-00903: invalid table name


SQL> update emp set eid=106 where ename='Bindu';

1 row updated.

SQL> select * from emp;

       EID ENAME                DOJ
---------- -------------------- ---------
       101 Krishna              10-JAN-26
       102 Sravan               09-JAN-26
       103 Saraswathi           05-AUG-25
       104 Srinivas             09-JAN-26
       106 Bindu                09-JAN-26

SQL> rollback;

Rollback complete.

SQL> select * from emp;

       EID ENAME                DOJ
---------- -------------------- ---------
       101 Krishna              10-JAN-26
       102 Sravan               09-JAN-26
       103 Saraswathi           05-AUG-25
       104 Srinivas             09-JAN-26
       105 Bindu                09-JAN-26

SQL> commit;

Commit complete.

SQL> update emp set eid=106 where ename='Bindu';

1 row updated.

SQL> update emp set eid=106 where ename='Sravan';

1 row updated.

SQL> update emp set eid=106 where ename='Krishna';

1 row updated.

SQL> select * from emp;

       EID ENAME                DOJ
---------- -------------------- ---------
       106 Krishna              10-JAN-26
       106 Sravan               09-JAN-26
       103 Saraswathi           05-AUG-25
       104 Srinivas             09-JAN-26
       106 Bindu                09-JAN-26

SQL> rollback;

Rollback complete.

SQL> select * from emp;

       EID ENAME                DOJ
---------- -------------------- ---------
       101 Krishna              10-JAN-26
       102 Sravan               09-JAN-26
       103 Saraswathi           05-AUG-25
       104 Srinivas             09-JAN-26
       105 Bindu                09-JAN-26

SQL> commit;

Commit complete.

SQL> truncate emp;
truncate emp
           *
ERROR at line 1:
ORA-03290: Invalid truncate command - missing CLUSTER or TABLE keyword


SQL> truncate table emp;

Table truncated.

SQL> select * from emp;

no rows selected

SQL> rollback;

Rollback complete.

SQL> select * from emp;

no rows selected

SQL> commit;

Commit complete.

SQL> drop table emp;

Table dropped.

SQL> rollback;

Rollback complete.

SQL> select * from emp;
select * from emp
              *
ERROR at line 1:
ORA-00942: table or view does not exist


SQL> select * from emp1;

       EID ENAME                DOJ
---------- -------------------- ---------
       101 Krishna              10-JAN-26
       102 Sravan               09-JAN-26
       103 Saraswathi           05-AUG-25
       104 Srinivas             09-JAN-26
       105 Bindu                09-JAN-26

SQL> insert into emp1 values(106,'Shyamala'sysdate);
insert into emp1 values(106,'Shyamala'sysdate)
                                      *
ERROR at line 1:
ORA-00917: missing comma


SQL> insert into emp1 values(106,'Shyamala',sysdate);

1 row created.

SQL> select * from emp1;

       EID ENAME                DOJ
---------- -------------------- ---------
       101 Krishna              10-JAN-26
       102 Sravan               09-JAN-26
       103 Saraswathi           05-AUG-25
       104 Srinivas             09-JAN-26
       105 Bindu                09-JAN-26
       106 Shyamala             09-JAN-26

6 rows selected.

SQL> commit;

Commit complete.

SQL>
=============
19-01-2026


SQL*Plus: Release 11.2.0.2.0 Production on Mon Jan 19 16:16:38 2026

Copyright (c) 1982, 2014, Oracle.  All rights reserved.

SQL> connect idb;
Enter password:
ERROR:
ORA-01017: invalid username/password; logon denied


SQL> connect idba;
Enter password:
Connected.
SQL> select * from tab;

TNAME                          TABTYPE  CLUSTERID
------------------------------ ------- ----------
EMP1                           TABLE
EMP2                           TABLE
STUDENT                        TABLE

SQL> select * from emp1;

       EID ENAME                DOJ
---------- -------------------- ---------
       101 Krishna              10-JAN-26
       102 Sravan               09-JAN-26
       103 Saraswathi           05-AUG-25
       104 Srinivas             09-JAN-26
       105 Bindu                09-JAN-26
       106 Shyamala             09-JAN-26

6 rows selected.

SQL> select * from emp2;

       EID ENAME                DOJ
---------- -------------------- ---------
       101 Krishna              10-JAN-26
       102 Sravan               09-JAN-26
       103 Saraswathi           05-AUG-25
       104 Srinivas             09-JAN-26
       105 Bindu                09-JAN-26

SQL> select * from student;

      HTNO SNAME                PERCENTAGE
---------- -------------------- ----------
       101 Krishna                   99.99
       102 Sravan                    99.99

SQL> create table s1 (sid number(3) primary key,sname varchar2(20) not null,mnuber number(10) unique);

Table created.

SQL> desc s1;
 Name                                      Null?    Type
 ----------------------------------------- -------- ----------------------------
 SID                                       NOT NULL NUMBER(3)
 SNAME                                     NOT NULL VARCHAR2(20)
 MNUBER                                             NUMBER(10)

SQL> insert into s1 values(1,'Krishna',12345);

1 row created.

SQL> select * from s1;

       SID SNAME                    MNUBER
---------- -------------------- ----------
         1 Krishna                   12345

SQL> insert into s1 values(1,'Krishna',123456);
insert into s1 values(1,'Krishna',123456)
*
ERROR at line 1:
ORA-00001: unique constraint (IDBA.SYS_C007127) violated


SQL> insert into s1 values(2,'Krishna',12345);
insert into s1 values(2,'Krishna',12345)
*
ERROR at line 1:
ORA-00001: unique constraint (IDBA.SYS_C007128) violated


SQL> insert into s1 values(2,'Krishna',123456);

1 row created.

SQL> select * from s1;

       SID SNAME                    MNUBER
---------- -------------------- ----------
         1 Krishna                   12345
         2 Krishna                  123456

SQL> insert into s1(sid,mnuber) values(3,1234567);
insert into s1(sid,mnuber) values(3,1234567)
*
ERROR at line 1:
ORA-01400: cannot insert NULL into ("IDBA"."S1"."SNAME")


SQL> insert into s1(sid,sname) values(3,'Krishna');

1 row created.

SQL> select * from s1;

       SID SNAME                    MNUBER
---------- -------------------- ----------
         1 Krishna                   12345
         2 Krishna                  123456
         3 Krishna

SQL> insert into s1(sid,sname) values(4,'Krishna');

1 row created.

SQL> create table s2 (sid number(3) primary key,marks number(10) check(marks<=100));

Table created.

SQL> desc s2;
 Name                                      Null?    Type
 ----------------------------------------- -------- ----------------------------
 SID                                       NOT NULL NUMBER(3)
 MARKS                                              NUMBER(10)

SQL> insert into s2 values(1,99);

1 row created.

SQL> select * from s2;

       SID      MARKS
---------- ----------
         1         99

SQL> insert into s2 values(1,101);
insert into s2 values(1,101)
*
ERROR at line 1:
ORA-02290: check constraint (IDBA.SYS_C007129) violated


SQL> SELECT CONSTRAINT_NAME, CONSTRAINT_TYPE FROM USER_CONSTRAINTS WHERE TABLE_NAME = 's1';

no rows selected

SQL> SELECT CONSTRAINT_NAME, CONSTRAINT_TYPE FROM USER_CONSTRAINTS WHERE TABLE_NAME = 'S1';

CONSTRAINT_NAME                C
------------------------------ -
SYS_C007126                    C
SYS_C007127                    P
SYS_C007128                    U

SQL> desc s1;
 Name                                      Null?    Type
 ----------------------------------------- -------- ----------------------------
 SID                                       NOT NULL NUMBER(3)
 SNAME                                     NOT NULL VARCHAR2(20)
 MNUBER                                             NUMBER(10)

SQL> SELECT CONSTRAINT_NAME, CONSTRAINT_TYPE FROM USER_CONSTRAINTS WHERE TABLE_NAME = 'S2';

CONSTRAINT_NAME                C
------------------------------ -
SYS_C007129                    C
SYS_C007130                    P

SQL>
SQL> ALTER TABLE S2 DROP CONSTRAINT "SYS_C007130";

Table altered.

SQL> insert into s2 values(1,101);
insert into s2 values(1,101)
*
ERROR at line 1:
ORA-02290: check constraint (IDBA.SYS_C007129) violated


SQL> ALTER TABLE S2 DROP CONSTRAINT "SYS_C007129";

Table altered.

SQL> insert into s2 values(1,101);

1 row created.

SQL> select * from s2;

       SID      MARKS
---------- ----------
         1         99
         1        101

SQL> ALTER TABLE S2 DROP CONSTRAINT check;
ALTER TABLE S2 DROP CONSTRAINT check
                               *
ERROR at line 1:
ORA-02250: missing or invalid constraint name


SQL> seclect * from dual;
SP2-0734: unknown command beginning "seclect * ..." - rest of line ignored.
SQL> select * from dual;

D
-
X

SQL> select 2+3 from dual;

       2+3
----------
         5

SQL> select 2+3 from s1;

       2+3
----------
         5
         5
         5
         5

SQL> select 2+3 from s2;

       2+3
----------
         5
         5

SQL> truncate s2;
truncate s2
          *
ERROR at line 1:
ORA-03290: Invalid truncate command - missing CLUSTER or TABLE keyword


SQL> truncate table s2;

Table truncated.

SQL> select 2+3 from s2;

no rows selected

SQL> select 2+3 from dual;

       2+3
----------
         5

SQL> select 2+3 as Addition from dual;

  ADDITION
----------
         5

SQL> select 2-3 as Addition from dual;

  ADDITION
----------
        -1

SQL> select 2-3 as Sub from dual;

       SUB
----------
        -1

SQL> select 5-3*4/2 as Bodmas from dual;

    BODMAS
----------
        -1

SQL> select * from emp1;

       EID ENAME                DOJ
---------- -------------------- ---------
       101 Krishna              10-JAN-26
       102 Sravan               09-JAN-26
       103 Saraswathi           05-AUG-25
       104 Srinivas             09-JAN-26
       105 Bindu                09-JAN-26
       106 Shyamala             09-JAN-26

6 rows selected.

SQL> select * from emp1 where eid=102;

       EID ENAME                DOJ
---------- -------------------- ---------
       102 Sravan               09-JAN-26

SQL> select * from emp1 where eid!=102;

       EID ENAME                DOJ
---------- -------------------- ---------
       101 Krishna              10-JAN-26
       103 Saraswathi           05-AUG-25
       104 Srinivas             09-JAN-26
       105 Bindu                09-JAN-26
       106 Shyamala             09-JAN-26

SQL> select * from emp1 where eid!=102;

       EID ENAME                DOJ
---------- -------------------- ---------
       101 Krishna              10-JAN-26
       103 Saraswathi           05-AUG-25
       104 Srinivas             09-JAN-26
       105 Bindu                09-JAN-26
       106 Shyamala             09-JAN-26

SQL> select * from emp1 where eid<>102;

       EID ENAME                DOJ
---------- -------------------- ---------
       101 Krishna              10-JAN-26
       103 Saraswathi           05-AUG-25
       104 Srinivas             09-JAN-26
       105 Bindu                09-JAN-26
       106 Shyamala             09-JAN-26

SQL> select * from emp1 where ename='Bindu';

       EID ENAME                DOJ
---------- -------------------- ---------
       105 Bindu                09-JAN-26

SQL> select * from emp1 where ename<='Bindu';

       EID ENAME                DOJ
---------- -------------------- ---------
       105 Bindu                09-JAN-26

SQL> select * from emp1 where ename<>'Bindu';

       EID ENAME                DOJ
---------- -------------------- ---------
       101 Krishna              10-JAN-26
       102 Sravan               09-JAN-26
       103 Saraswathi           05-AUG-25
       104 Srinivas             09-JAN-26
       106 Shyamala             09-JAN-26

SQL> select * from emp1 where eid=102 and ename='Bindu';

no rows selected

SQL> select * from emp1 where eid=102 or ename='Bindu';

       EID ENAME                DOJ
---------- -------------------- ---------
       102 Sravan               09-JAN-26
       105 Bindu                09-JAN-26

SQL> select * from emp1 where eid=105 and ename='Bindu';

       EID ENAME                DOJ
---------- -------------------- ---------
       105 Bindu                09-JAN-26

SQL> select * from emp1 where eid=105 or ename='Bindu';

       EID ENAME                DOJ
---------- -------------------- ---------
       105 Bindu                09-JAN-26

SQL> select * from emp1 where eid=100 or ename='Bindudtffr';

no rows selected

SQL> select * from emp1 where eid=100 and ename='Bindudtffr';

no rows selected

SQL> select * from emp1 where not eid=101;

       EID ENAME                DOJ
---------- -------------------- ---------
       102 Sravan               09-JAN-26
       103 Saraswathi           05-AUG-25
       104 Srinivas             09-JAN-26
       105 Bindu                09-JAN-26
       106 Shyamala             09-JAN-26

SQL> select * from emp1 where not eid=100;

       EID ENAME                DOJ
---------- -------------------- ---------
       101 Krishna              10-JAN-26
       102 Sravan               09-JAN-26
       103 Saraswathi           05-AUG-25
       104 Srinivas             09-JAN-26
       105 Bindu                09-JAN-26
       106 Shyamala             09-JAN-26

6 rows selected.

SQL> select * from emp1 where eid=null;

no rows selected

SQL> select * from s1 where eid=null;
select * from s1 where eid=null
                       *
ERROR at line 1:
ORA-00904: "EID": invalid identifier


SQL> select * from s1 where mnuber=null;

no rows selected

SQL> select * from s1;

       SID SNAME                    MNUBER
---------- -------------------- ----------
         1 Krishna                   12345
         2 Krishna                  123456
         3 Krishna
         4 Krishna

SQL> select * from s1 where mnuber=null;

no rows selected

SQL> select * from s1 where mnuber= not null;
select * from s1 where mnuber= not null
                               *
ERROR at line 1:
ORA-00936: missing expression


SQL> select * from s1 where mnuber= notnull;
select * from s1 where mnuber= notnull
                               *
ERROR at line 1:
ORA-00904: "NOTNULL": invalid identifier


SQL> select * from s1 where mnuber is not null;

       SID SNAME                    MNUBER
---------- -------------------- ----------
         1 Krishna                   12345
         2 Krishna                  123456

SQL> select * from s1 where mnuber is null;

       SID SNAME                    MNUBER
---------- -------------------- ----------
         3 Krishna
         4 Krishna

SQL> select * from s1;

       SID SNAME                    MNUBER
---------- -------------------- ----------
         1 Krishna                   12345
         2 Krishna                  123456
         3 Krishna
         4 Krishna

SQL> select mnuber from s1;

    MNUBER
----------
     12345
    123456



SQL> select * from emp1 where ename like "S%";
select * from emp1 where ename like "S%"
                                    *
ERROR at line 1:
ORA-00904: "S%": invalid identifier


SQL> select * from emp1 where ename like 'S%';

       EID ENAME                DOJ
---------- -------------------- ---------
       102 Sravan               09-JAN-26
       103 Saraswathi           05-AUG-25
       104 Srinivas             09-JAN-26
       106 Shyamala             09-JAN-26

SQL> select * from emp1 where ename like 's%';

no rows selected

SQL> select * from emp1 where ename like '%s';

       EID ENAME                DOJ
---------- -------------------- ---------
       104 Srinivas             09-JAN-26

SQL> select * from emp1;

       EID ENAME                DOJ
---------- -------------------- ---------
       101 Krishna              10-JAN-26
       102 Sravan               09-JAN-26
       103 Saraswathi           05-AUG-25
       104 Srinivas             09-JAN-26
       105 Bindu                09-JAN-26
       106 Shyamala             09-JAN-26

6 rows selected.

SQL> select * from emp1 where ename like 'Sr%';

       EID ENAME                DOJ
---------- -------------------- ---------
       102 Sravan               09-JAN-26
       104 Srinivas             09-JAN-26

SQL> select * from emp1 where ename like '%r%';

       EID ENAME                DOJ
---------- -------------------- ---------
       101 Krishna              10-JAN-26
       102 Sravan               09-JAN-26
       103 Saraswathi           05-AUG-25
       104 Srinivas             09-JAN-26

SQL> select * from emp1 where ename like '%ra%';

       EID ENAME                DOJ
---------- -------------------- ---------
       102 Sravan               09-JAN-26
       103 Saraswathi           05-AUG-25

SQL> select * from emp1 where ename like '%a%';

       EID ENAME                DOJ
---------- -------------------- ---------
       101 Krishna              10-JAN-26
       102 Sravan               09-JAN-26
       103 Saraswathi           05-AUG-25
       104 Srinivas             09-JAN-26
       106 Shyamala             09-JAN-26

SQL> select * from emp1 where ename like  '%[a-z]%';

no rows selected

SQL> select * from emp1 where ename like  '[a-z]%';

no rows selected

SQL> select * from emp1 where ename like  '[K-z]%';

no rows selected

SQL> select * from emp1 where ename like  '%[K-z]%';

no rows selected

SQL> select * from emp1 where ename like  '%[K-Z]%';

no rows selected

SQL> select * from emp1 where ename like  '%[K]%';

no rows selected

SQL> select * from emp1 where ename like  '%[S]%';

no rows selected

SQL> select * from emp2;

       EID ENAME                DOJ
---------- -------------------- ---------
       101 Krishna              10-JAN-26
       102 Sravan               09-JAN-26
       103 Saraswathi           05-AUG-25
       104 Srinivas             09-JAN-26
       105 Bindu                09-JAN-26

SQL> select * from emp1;;
select * from emp1;
                  *
ERROR at line 1:
ORA-00911: invalid character


SQL> select * from emp1;

       EID ENAME                DOJ
---------- -------------------- ---------
       101 Krishna              10-JAN-26
       102 Sravan               09-JAN-26
       103 Saraswathi           05-AUG-25
       104 Srinivas             09-JAN-26
       105 Bindu                09-JAN-26
       106 Shyamala             09-JAN-26

6 rows selected.

SQL> select * from emp1 where eid in(101,105);

       EID ENAME                DOJ
---------- -------------------- ---------
       101 Krishna              10-JAN-26
       105 Bindu                09-JAN-26

SQL> select * from emp1 where eid in(101,100);

       EID ENAME                DOJ
---------- -------------------- ---------
       101 Krishna              10-JAN-26

SQL> select * from emp1 where eid between 101 to 105;
select * from emp1 where eid between 101 to 105
                                         *
ERROR at line 1:
ORA-00905: missing keyword


SQL> select * from emp1 where eid between 101 and 105;

       EID ENAME                DOJ
---------- -------------------- ---------
       101 Krishna              10-JAN-26
       102 Sravan               09-JAN-26
       103 Saraswathi           05-AUG-25
       104 Srinivas             09-JAN-26
       105 Bindu                09-JAN-26

SQL> select * from emp1 where eid between 0 and 1000;

       EID ENAME                DOJ
---------- -------------------- ---------
       101 Krishna              10-JAN-26
       102 Sravan               09-JAN-26
       103 Saraswathi           05-AUG-25
       104 Srinivas             09-JAN-26
       105 Bindu                09-JAN-26
       106 Shyamala             09-JAN-26

6 rows selected.

SQL>
------------------------------
20-0-2026
--

SQL*Plus: Release 11.2.0.2.0 Production on Tue Jan 20 16:15:44 2026

Copyright (c) 1982, 2014, Oracle.  All rights reserved.

SQL> connect idba;
Enter password:
Connected.
SQL> create table customer(id number(3),name varchar2(10),age number(3),address varchar2(10),salary number(5));

Table created.

SQL> insert into customer values(101,'Krishna',25,'Hyd',50000);

1 row created.

SQL> insert into customer values(102,'Nandhini',20,'VJA',20000);

1 row created.

SQL> insert into customer values(103,'Supraja',50,'KMM',40000);

1 row created.

SQL> insert into customer values(104,'Supraja',30,'KMM',30000);

1 row created.

SQL> insert into customer values(105,'Bindu',60,'GTN',70000);

1 row created.

SQL> select * from customer;

        ID NAME              AGE ADDRESS        SALARY
---------- ---------- ---------- ---------- ----------
       101 Krishna            25 Hyd             50000
       102 Nandhini           20 VJA             20000
       103 Supraja            50 KMM             40000
       104 Supraja            30 KMM             30000
       105 Bindu              60 GTN             70000

SQL> SELECT AGE FROM CUSTOMER WHERE EXISTS (SELECT AGE FROM CUSTOMERS WHERE SALARY > 40000);
SELECT AGE FROM CUSTOMER WHERE EXISTS (SELECT AGE FROM CUSTOMERS WHERE SALARY > 40000)
                                                       *
ERROR at line 1:
ORA-00942: table or view does not exist


SQL> SELECT AGE FROM CUSTOMER WHERE EXISTS (SELECT AGE FROM CUSTOMER WHERE SALARY > 40000);

       AGE
----------
        25
        20
        50
        30
        60

SQL> SELECT AGE FROM CUSTOMER WHERE SALARY > 40000;

       AGE
----------
        25
        60

SQL> SELECT AGE FROM CUSTOMER WHERE EXISTS (SELECT AGE FROM CUSTOMER WHERE SALARY > 65000);

       AGE
----------
        25
        20
        50
        30
        60

SQL> SELECT AGE FROM CUSTOMER WHERE EXISTS (SELECT AGE FROM CUSTOMER WHERE SALARY > 6500);

       AGE
----------
        25
        20
        50
        30
        60

SQL> SELECT AGE FROM CUSTOMER WHERE EXISTS (SELECT AGE FROM CUSTOMER WHERE SALARY > 650000);

no rows selected

SQL> SELECT * FROM CUSTOMER WHERE AGE > ALL (SELECT AGE FROM CUSTOMER WHERE SALARY > 40000);

no rows selected

SQL> SELECT * FROM CUSTOMER WHERE AGE > Any (SELECT AGE FROM CUSTOMER WHERE SALARY > 40000);

        ID NAME              AGE ADDRESS        SALARY
---------- ---------- ---------- ---------- ----------
       103 Supraja            50 KMM             40000
       104 Supraja            30 KMM             30000
       105 Bindu              60 GTN             70000

SQL> SELECT AGE FROM CUSTOMER WHERE SALARY > 40000;

       AGE
----------
        25
        60

SQL> SELECT * FROM CUSTOMER WHERE AGE > ALL (SELECT AGE FROM CUSTOMER WHERE SALARY > 40000);

no rows selected

SQL> select * from customer;

        ID NAME              AGE ADDRESS        SALARY
---------- ---------- ---------- ---------- ----------
       101 Krishna            25 Hyd             50000
       102 Nandhini           20 VJA             20000
       103 Supraja            50 KMM             40000
       104 Supraja            30 KMM             30000
       105 Bindu              60 GTN             70000

SQL> SELECT * FROM CUSTOMER WHERE AGE >= ALL (SELECT AGE FROM CUSTOMER WHERE SALARY > 40000);

        ID NAME              AGE ADDRESS        SALARY
---------- ---------- ---------- ---------- ----------
       105 Bindu              60 GTN             70000

SQL> SELECT * FROM CUSTOMER WHERE AGE > ALL (SELECT AGE FROM CUSTOMER WHERE SALARY > 40000);

no rows selected

SQL> SELECT * FROM CUSTOMER WHERE AGE > Any (SELECT AGE FROM CUSTOMER WHERE SALARY > 40000);

        ID NAME              AGE ADDRESS        SALARY
---------- ---------- ---------- ---------- ----------
       103 Supraja            50 KMM             40000
       104 Supraja            30 KMM             30000
       105 Bindu              60 GTN             70000

SQL> select * from customer;

        ID NAME              AGE ADDRESS        SALARY
---------- ---------- ---------- ---------- ----------
       101 Krishna            25 Hyd             50000
       102 Nandhini           20 VJA             20000
       103 Supraja            50 KMM             40000
       104 Supraja            30 KMM             30000
       105 Bindu              60 GTN             70000

SQL> SELECT AGE FROM CUSTOMER WHERE SALARY > 40000;

       AGE
----------
        25
        60

SQL> SELECT * FROM CUSTOMER WHERE AGE > ALL (SELECT AGE FROM CUSTOMER WHERE SALARY > 40000);

no rows selected

SQL> SELECT * FROM CUSTOMER WHERE AGE >= Any (SELECT AGE FROM CUSTOMER WHERE SALARY > 40000);

        ID NAME              AGE ADDRESS        SALARY
---------- ---------- ---------- ---------- ----------
       101 Krishna            25 Hyd             50000
       103 Supraja            50 KMM             40000
       104 Supraja            30 KMM             30000
       105 Bindu              60 GTN             70000

SQL> select * from customer;

        ID NAME              AGE ADDRESS        SALARY
---------- ---------- ---------- ---------- ----------
       101 Krishna            25 Hyd             50000
       102 Nandhini           20 VJA             20000
       103 Supraja            50 KMM             40000
       104 Supraja            30 KMM             30000
       105 Bindu              60 GTN             70000

SQL> select * from customer where age>30;

        ID NAME              AGE ADDRESS        SALARY
---------- ---------- ---------- ---------- ----------
       103 Supraja            50 KMM             40000
       105 Bindu              60 GTN             70000

SQL> select * from customer where age>30 and salary>50000;

        ID NAME              AGE ADDRESS        SALARY
---------- ---------- ---------- ---------- ----------
       105 Bindu              60 GTN             70000

SQL> select * from customer where age>30 or salary>50000;

        ID NAME              AGE ADDRESS        SALARY
---------- ---------- ---------- ---------- ----------
       103 Supraja            50 KMM             40000
       105 Bindu              60 GTN             70000

SQL> select * from customer where age>30;

        ID NAME              AGE ADDRESS        SALARY
---------- ---------- ---------- ---------- ----------
       103 Supraja            50 KMM             40000
       105 Bindu              60 GTN             70000

SQL> select * from customer where age>30 order by name;

        ID NAME              AGE ADDRESS        SALARY
---------- ---------- ---------- ---------- ----------
       105 Bindu              60 GTN             70000
       103 Supraja            50 KMM             40000

SQL> select * from customer order by name asc;

        ID NAME              AGE ADDRESS        SALARY
---------- ---------- ---------- ---------- ----------
       105 Bindu              60 GTN             70000
       101 Krishna            25 Hyd             50000
       102 Nandhini           20 VJA             20000
       104 Supraja            30 KMM             30000
       103 Supraja            50 KMM             40000

SQL> select * from customer;

        ID NAME              AGE ADDRESS        SALARY
---------- ---------- ---------- ---------- ----------
       101 Krishna            25 Hyd             50000
       102 Nandhini           20 VJA             20000
       103 Supraja            50 KMM             40000
       104 Supraja            30 KMM             30000
       105 Bindu              60 GTN             70000

SQL> select * from customer order by name;

        ID NAME              AGE ADDRESS        SALARY
---------- ---------- ---------- ---------- ----------
       105 Bindu              60 GTN             70000
       101 Krishna            25 Hyd             50000
       102 Nandhini           20 VJA             20000
       104 Supraja            30 KMM             30000
       103 Supraja            50 KMM             40000

SQL> select * from customer order by name desc;

        ID NAME              AGE ADDRESS        SALARY
---------- ---------- ---------- ---------- ----------
       103 Supraja            50 KMM             40000
       104 Supraja            30 KMM             30000
       102 Nandhini           20 VJA             20000
       101 Krishna            25 Hyd             50000
       105 Bindu              60 GTN             70000

SQL> select name from customer order by name desc;

NAME
----------
Supraja
Supraja
Nandhini
Krishna
Bindu

SQL> select name,id from customer order by name desc;

NAME               ID
---------- ----------
Supraja           103
Supraja           104
Nandhini          102
Krishna           101
Bindu             105

SQL> select name as cname,id as cid from customer order by name desc;

CNAME             CID
---------- ----------
Supraja           103
Supraja           104
Nandhini          102
Krishna           101
Bindu             105

SQL> create view cv1 as id,name,salary where age>30;
create view cv1 as id,name,salary where age>30
                   *
ERROR at line 1:
ORA-00928: missing SELECT keyword


SQL> create view cv1 as select id,name,salary where age>30;
create view cv1 as select id,name,salary where age>30
                                         *
ERROR at line 1:
ORA-00923: FROM keyword not found where expected


SQL> create view cv1 as select id,name,salary from customer where age>30;

View created.

SQL> select * from cv1;

        ID NAME           SALARY
---------- ---------- ----------
       103 Supraja         40000
       105 Bindu           70000

SQL> select id,name,salary from customer where age>30;

        ID NAME           SALARY
---------- ---------- ----------
       103 Supraja         40000
       105 Bindu           70000

SQL> select * from tab;

TNAME                          TABTYPE  CLUSTERID
------------------------------ ------- ----------
CUSTOMER                       TABLE
CV1                            VIEW
EMP1                           TABLE
EMP2                           TABLE
S1                             TABLE
S2                             TABLE
STUDENT                        TABLE

7 rows selected.

SQL> update customer set salary=44000 where id=103;

1 row updated.

SQL> select * from customer;

        ID NAME              AGE ADDRESS        SALARY
---------- ---------- ---------- ---------- ----------
       101 Krishna            25 Hyd             50000
       102 Nandhini           20 VJA             20000
       103 Supraja            50 KMM             44000
       104 Supraja            30 KMM             30000
       105 Bindu              60 GTN             70000

SQL> select * from cv1;

        ID NAME           SALARY
---------- ---------- ----------
       103 Supraja         44000
       105 Bindu           70000

SQL>
